Started by user [8mha:////4FTCqNFiKLpyn30lOIdVm1IpFtll+75UhAowWr8E/lnxAAAAlx+LCAAAAAAAAP9b85aBtbiIQTGjNKU4P08vOT+vOD8nVc83PyU1x6OyILUoJzMv2y+/JJUBAhiZGBgqihhk0NSjKDWzXb3RdlLBUSYGJk8GtpzUvPSSDB8G5tKinBIGIZ+sxLJE/ZzEvHT94JKizLx0a6BxUmjGOUNodHsLgAz2EgZu/dLi1CL9xJTczDwAHhAahcAAAAA=[0mlakshmi
Running as SYSTEM
Building remotely on [8mha:////4OiLuvFyY4C7gX+/755G+tzvkK7uBHhKDgA6xKAk4bdbAAAAnR+LCAAAAAAAAP9b85aBtbiIQTGjNKU4P08vOT+vOD8nVc83PyU1x6OyILUoJzMv2y+/JJUBAhiZGBgqihhk0NSjKDWzXb3RdlLBUSYGJk8GtpzUvPSSDB8G5tKinBIGIZ+sxLJE/ZzEvHT94JKizLx0a6BxUmjGOUNodHsLgAz2EgZB/eT83ILSktQi/fLMvJT88mIALPIANMYAAAA=[0mwindows in workspace C:\Windows\System32\config\systemprofile\AppData\Local\Jenkins\.jenkins\workspace\selenium-webdriver
The recommended git tool is: NONE
No credentials specified
Cloning the remote Git repository
Cloning repository https://github.com/lakshmi4025/Selenium-WebDriver-TestNG-priority.git
 > git init C:\Windows\System32\config\systemprofile\AppData\Local\Jenkins\.jenkins\workspace\selenium-webdriver # timeout=10
Fetching upstream changes from https://github.com/lakshmi4025/Selenium-WebDriver-TestNG-priority.git
 > git --version # timeout=10
 > git --version # 'git version 2.32.0.windows.2'
 > git fetch --tags --force --progress -- https://github.com/lakshmi4025/Selenium-WebDriver-TestNG-priority.git +refs/heads/*:refs/remotes/origin/* # timeout=10
 > git config remote.origin.url https://github.com/lakshmi4025/Selenium-WebDriver-TestNG-priority.git # timeout=10
 > git config --add remote.origin.fetch +refs/heads/*:refs/remotes/origin/* # timeout=10
Avoid second fetch
 > git rev-parse "refs/remotes/origin/master^{commit}" # timeout=10
Checking out Revision 8cba379ecc5f41875024fcb0dedfc54ae023aa8c (refs/remotes/origin/master)
 > git config core.sparsecheckout # timeout=10
 > git checkout -f 8cba379ecc5f41875024fcb0dedfc54ae023aa8c # timeout=10
Commit message: "Initial check-in"
First time build. Skipping changelog.
[Checks API] No suitable checks publisher found.
[selenium-webdriver] $ cmd.exe /C "mvn -f pom.xml install && exit %%ERRORLEVEL%%"
[INFO] Scanning for projects...
[INFO] 
[INFO] -----------< seleniumTestNGPriority:seleniumTestNGPriority >------------
[INFO] Building seleniumTestNGPriority 0.0.1-SNAPSHOT
[INFO] --------------------------------[ jar ]---------------------------------
Downloading from central: https://repo.maven.apache.org/maven2/org/apache/maven/plugins/maven-surefire-plugin/2.19.1/maven-surefire-plugin-2.19.1.pom
Progress (1): 2.7/5.6 kBProgress (1): 5.5/5.6 kBProgress (1): 5.6 kB                        Downloaded from central: https://repo.maven.apache.org/maven2/org/apache/maven/plugins/maven-surefire-plugin/2.19.1/maven-surefire-plugin-2.19.1.pom (5.6 kB at 1.2 kB/s)
Downloading from central: https://repo.maven.apache.org/maven2/org/apache/maven/surefire/surefire/2.19.1/surefire-2.19.1.pom
Progress (1): 2.7/18 kBProgress (1): 5.5/18 kBProgress (1): 8.2/18 kBProgress (1): 11/18 kB Progress (1): 14/18 kBProgress (1): 16/18 kBProgress (1): 18 kB                      Downloaded from central: https://repo.maven.apache.org/maven2/org/apache/maven/surefire/surefire/2.19.1/surefire-2.19.1.pom (18 kB at 31 kB/s)
Downloading from central: https://repo.maven.apache.org/maven2/org/apache/maven/maven-parent/26/maven-parent-26.pom
Progress (1): 2.7/40 kBProgress (1): 5.5/40 kBProgress (1): 8.2/40 kBProgress (1): 11/40 kB Progress (1): 14/40 kBProgress (1): 16/40 kBProgress (1): 19/40 kBProgress (1): 22/40 kBProgress (1): 25/40 kBProgress (1): 27/40 kBProgress (1): 30/40 kBProgress (1): 33/40 kBProgress (1): 36/40 kBProgress (1): 38/40 kBProgress (1): 40 kB                      Downloaded from central: https://repo.maven.apache.org/maven2/org/apache/maven/maven-parent/26/maven-parent-26.pom (40 kB at 55 kB/s)
Downloading from central: https://repo.maven.apache.org/maven2/org/apache/maven/plugins/maven-surefire-plugin/2.19.1/maven-surefire-plugin-2.19.1.jar
Progress (1): 4.1/38 kBProgress (1): 8.2/38 kBProgress (1): 12/38 kB Progress (1): 16/38 kBProgress (1): 20/38 kBProgress (1): 25/38 kBProgress (1): 29/38 kBProgress (1): 33/38 kBProgress (1): 37/38 kBProgress (1): 38 kB                      Downloaded from central: https://repo.maven.apache.org/maven2/org/apache/maven/plugins/maven-surefire-plugin/2.19.1/maven-surefire-plugin-2.19.1.jar (38 kB at 65 kB/s)
[INFO] 
[8mha:////4DAs6orfhaq6r4nyRih9UDFr1E3U8XylybJoHK238fPvAAAAYB+LCAAAAAAAAP9b85aBtbiIQSmjNKU4P0+vJLE4u1gvPjexLDVPzxdEGvvmZ+X75Zek2mxOX+vh68DGxMBQUcQgBdWQnJ9XnJ+TqucMoUEKGSCAEaSwAAAn9LoiYAAAAA==[0m[INFO] --- maven-resources-plugin:2.6:resources (default-resources) @ seleniumTestNGPriority ---
[8mha:////4HOTkYkeSplnovF16d/jvFnqgIsFdsez6SJD82hTgwKFAAAAYh+LCAAAAAAAAP9b85aBtbiIQSWjNKU4P0+vJLE4u1gvPjexLDVPzxdEhicW5WXmpfvll6SeOJwgmrt9CSsTA0NFEYMUVEtyfl5xfk6qnjOEBilkgABGkMICAEQzmI1iAAAA[0m[WARNING] Using platform encoding (Cp1252 actually) to copy filtered resources, i.e. build is platform dependent!
[INFO] skip non existing resourceDirectory C:\Windows\System32\config\systemprofile\AppData\Local\Jenkins\.jenkins\workspace\selenium-webdriver\src\main\resources
[INFO] 
[8mha:////4DAs6orfhaq6r4nyRih9UDFr1E3U8XylybJoHK238fPvAAAAYB+LCAAAAAAAAP9b85aBtbiIQSmjNKU4P0+vJLE4u1gvPjexLDVPzxdEGvvmZ+X75Zek2mxOX+vh68DGxMBQUcQgBdWQnJ9XnJ+TqucMoUEKGSCAEaSwAAAn9LoiYAAAAA==[0m[INFO] --- maven-compiler-plugin:3.8.1:compile (default-compile) @ seleniumTestNGPriority ---
[INFO] Changes detected - recompiling the module!
[8mha:////4HOTkYkeSplnovF16d/jvFnqgIsFdsez6SJD82hTgwKFAAAAYh+LCAAAAAAAAP9b85aBtbiIQSWjNKU4P0+vJLE4u1gvPjexLDVPzxdEhicW5WXmpfvll6SeOJwgmrt9CSsTA0NFEYMUVEtyfl5xfk6qnjOEBilkgABGkMICAEQzmI1iAAAA[0m[WARNING] File encoding has not been set, using platform encoding Cp1252, i.e. build is platform dependent!
[INFO] Compiling 1 source file to C:\Windows\System32\config\systemprofile\AppData\Local\Jenkins\.jenkins\workspace\selenium-webdriver\target\classes
[INFO] 
[8mha:////4DAs6orfhaq6r4nyRih9UDFr1E3U8XylybJoHK238fPvAAAAYB+LCAAAAAAAAP9b85aBtbiIQSmjNKU4P0+vJLE4u1gvPjexLDVPzxdEGvvmZ+X75Zek2mxOX+vh68DGxMBQUcQgBdWQnJ9XnJ+TqucMoUEKGSCAEaSwAAAn9LoiYAAAAA==[0m[INFO] --- maven-resources-plugin:2.6:testResources (default-testResources) @ seleniumTestNGPriority ---
[8mha:////4HOTkYkeSplnovF16d/jvFnqgIsFdsez6SJD82hTgwKFAAAAYh+LCAAAAAAAAP9b85aBtbiIQSWjNKU4P0+vJLE4u1gvPjexLDVPzxdEhicW5WXmpfvll6SeOJwgmrt9CSsTA0NFEYMUVEtyfl5xfk6qnjOEBilkgABGkMICAEQzmI1iAAAA[0m[WARNING] Using platform encoding (Cp1252 actually) to copy filtered resources, i.e. build is platform dependent!
[INFO] skip non existing resourceDirectory C:\Windows\System32\config\systemprofile\AppData\Local\Jenkins\.jenkins\workspace\selenium-webdriver\src\test\resources
[INFO] 
[8mha:////4DAs6orfhaq6r4nyRih9UDFr1E3U8XylybJoHK238fPvAAAAYB+LCAAAAAAAAP9b85aBtbiIQSmjNKU4P0+vJLE4u1gvPjexLDVPzxdEGvvmZ+X75Zek2mxOX+vh68DGxMBQUcQgBdWQnJ9XnJ+TqucMoUEKGSCAEaSwAAAn9LoiYAAAAA==[0m[INFO] --- maven-compiler-plugin:3.8.1:testCompile (default-testCompile) @ seleniumTestNGPriority ---
[INFO] No sources to compile
[INFO] 
[8mha:////4DAs6orfhaq6r4nyRih9UDFr1E3U8XylybJoHK238fPvAAAAYB+LCAAAAAAAAP9b85aBtbiIQSmjNKU4P0+vJLE4u1gvPjexLDVPzxdEGvvmZ+X75Zek2mxOX+vh68DGxMBQUcQgBdWQnJ9XnJ+TqucMoUEKGSCAEaSwAAAn9LoiYAAAAA==[0m[INFO] --- maven-surefire-plugin:2.19.1:test (default-test) @ seleniumTestNGPriority ---
Downloading from central: https://repo.maven.apache.org/maven2/org/apache/maven/surefire/maven-surefire-common/2.19.1/maven-surefire-common-2.19.1.pom
Progress (1): 4.1/7.3 kBProgress (1): 7.3 kB                        Downloaded from central: https://repo.maven.apache.org/maven2/org/apache/maven/surefire/maven-surefire-common/2.19.1/maven-surefire-common-2.19.1.pom (7.3 kB at 13 kB/s)
Downloading from central: https://repo.maven.apache.org/maven2/org/apache/maven/plugin-tools/maven-plugin-annotations/3.3/maven-plugin-annotations-3.3.pom
Progress (1): 1.6 kB                    Downloaded from central: https://repo.maven.apache.org/maven2/org/apache/maven/plugin-tools/maven-plugin-annotations/3.3/maven-plugin-annotations-3.3.pom (1.6 kB at 3.0 kB/s)
Downloading from central: https://repo.maven.apache.org/maven2/org/apache/maven/plugin-tools/maven-plugin-tools/3.3/maven-plugin-tools-3.3.pom
Progress (1): 4.1/13 kBProgress (1): 8.2/13 kBProgress (1): 12/13 kB Progress (1): 13 kB                      Downloaded from central: https://repo.maven.apache.org/maven2/org/apache/maven/plugin-tools/maven-plugin-tools/3.3/maven-plugin-tools-3.3.pom (13 kB at 22 kB/s)
Downloading from central: https://repo.maven.apache.org/maven2/org/apache/maven/surefire/surefire-api/2.19.1/surefire-api-2.19.1.pom
Progress (1): 3.5 kB                    Downloaded from central: https://repo.maven.apache.org/maven2/org/apache/maven/surefire/surefire-api/2.19.1/surefire-api-2.19.1.pom (3.5 kB at 6.3 kB/s)
Downloading from central: https://repo.maven.apache.org/maven2/org/apache/maven/surefire/surefire-booter/2.19.1/surefire-booter-2.19.1.pom
Progress (1): 3.2 kB                    Downloaded from central: https://repo.maven.apache.org/maven2/org/apache/maven/surefire/surefire-booter/2.19.1/surefire-booter-2.19.1.pom (3.2 kB at 5.9 kB/s)
Downloading from central: https://repo.maven.apache.org/maven2/org/apache/maven/surefire/maven-surefire-common/2.19.1/maven-surefire-common-2.19.1.jar
Downloading from central: https://repo.maven.apache.org/maven2/org/apache/maven/surefire/surefire-booter/2.19.1/surefire-booter-2.19.1.jar
Downloading from central: https://repo.maven.apache.org/maven2/org/apache/maven/surefire/surefire-api/2.19.1/surefire-api-2.19.1.jar
Downloading from central: https://repo.maven.apache.org/maven2/org/apache/maven/plugin-tools/maven-plugin-annotations/3.3/maven-plugin-annotations-3.3.jar
Progress (1): 4.1/46 kBProgress (1): 8.2/46 kBProgress (1): 12/46 kB Progress (1): 16/46 kBProgress (1): 20/46 kBProgress (1): 25/46 kBProgress (1): 29/46 kBProgress (1): 33/46 kBProgress (1): 37/46 kBProgress (1): 41/46 kBProgress (1): 45/46 kBProgress (1): 46 kB                      Downloaded from central: https://repo.maven.apache.org/maven2/org/apache/maven/surefire/surefire-booter/2.19.1/surefire-booter-2.19.1.jar (46 kB at 73 kB/s)
Progress (1): 2.7/14 kBProgress (2): 2.7/14 kB | 2.7/196 kBProgress (2): 5.5/14 kB | 2.7/196 kBProgress (2): 5.5/14 kB | 5.5/196 kBProgress (2): 8.2/14 kB | 5.5/196 kBProgress (2): 8.2/14 kB | 8.2/196 kBProgress (2): 11/14 kB | 8.2/196 kB Progress (2): 11/14 kB | 11/196 kB Progress (2): 14/14 kB | 11/196 kBProgress (2): 14/14 kB | 14/196 kBProgress (2): 14 kB | 14/196 kB   Progress (2): 14 kB | 16/196 kBProgress (2): 14 kB | 19/196 kBProgress (2): 14 kB | 22/196 kBProgress (3): 14 kB | 22/196 kB | 2.7/293 kBProgress (3): 14 kB | 22/196 kB | 5.5/293 kBProgress (3): 14 kB | 22/196 kB | 8.2/293 kBProgress (3): 14 kB | 25/196 kB | 8.2/293 kBProgress (3): 14 kB | 25/196 kB | 11/293 kB Progress (3): 14 kB | 25/196 kB | 14/293 kBProgress (3): 14 kB | 25/196 kB | 16/293 kBProgress (3): 14 kB | 27/196 kB | 16/293 kBProgress (3): 14 kB | 27/196 kB | 19/293 kBProgress (3): 14 kB | 30/196 kB | 19/293 kBProgress (3): 14 kB | 30/196 kB | 22/293 kBProgress (3): 14 kB | 30/196 kB | 25/293 kBProgress (3): 14 kB | 33/196 kB | 25/293 kBProgress (3): 14 kB | 33/196 kB | 27/293 kBProgress (3): 14 kB | 36/196 kB | 27/293 kBProgress (3): 14 kB | 36/196 kB | 30/293 kBProgress (3): 14 kB | 36/196 kB | 33/293 kBProgress (3): 14 kB | 38/196 kB | 33/293 kBProgress (3): 14 kB | 38/196 kB | 36/293 kBProgress (3): 14 kB | 38/196 kB | 38/293 kBProgress (3): 14 kB | 38/196 kB | 41/293 kBProgress (3): 14 kB | 41/196 kB | 41/293 kBProgress (3): 14 kB | 44/196 kB | 41/293 kBProgress (3): 14 kB | 47/196 kB | 41/293 kBProgress (3): 14 kB | 49/196 kB | 41/293 kBProgress (3): 14 kB | 52/196 kB | 41/293 kBProgress (3): 14 kB | 55/196 kB | 41/293 kB                                           Downloaded from central: https://repo.maven.apache.org/maven2/org/apache/maven/plugin-tools/maven-plugin-annotations/3.3/maven-plugin-annotations-3.3.jar (14 kB at 12 kB/s)
Progress (2): 58/196 kB | 41/293 kBProgress (2): 58/196 kB | 44/293 kBProgress (2): 58/196 kB | 47/293 kBProgress (2): 60/196 kB | 47/293 kBProgress (2): 63/196 kB | 47/293 kBProgress (2): 63/196 kB | 49/293 kBProgress (2): 66/196 kB | 49/293 kBProgress (2): 66/196 kB | 52/293 kBProgress (2): 66/196 kB | 55/293 kBProgress (2): 66/196 kB | 58/293 kBProgress (2): 70/196 kB | 58/293 kBProgress (2): 74/196 kB | 58/293 kBProgress (2): 78/196 kB | 58/293 kBProgress (2): 82/196 kB | 58/293 kBProgress (2): 82/196 kB | 60/293 kBProgress (2): 82/196 kB | 63/293 kBProgress (2): 82/196 kB | 66/293 kBProgress (2): 86/196 kB | 66/293 kBProgress (2): 90/196 kB | 66/293 kBProgress (2): 94/196 kB | 66/293 kBProgress (2): 99/196 kB | 66/293 kBProgress (2): 103/196 kB | 66/293 kBProgress (2): 107/196 kB | 66/293 kBProgress (2): 111/196 kB | 66/293 kBProgress (2): 115/196 kB | 66/293 kBProgress (2): 115/196 kB | 70/293 kBProgress (2): 115/196 kB | 74/293 kBProgress (2): 115/196 kB | 78/293 kBProgress (2): 115/196 kB | 82/293 kBProgress (2): 115/196 kB | 86/293 kBProgress (2): 115/196 kB | 90/293 kBProgress (2): 115/196 kB | 94/293 kBProgress (2): 115/196 kB | 99/293 kBProgress (2): 115/196 kB | 103/293 kBProgress (2): 115/196 kB | 107/293 kBProgress (2): 115/196 kB | 111/293 kBProgress (2): 115/196 kB | 115/293 kBProgress (2): 119/196 kB | 115/293 kBProgress (2): 123/196 kB | 115/293 kBProgress (2): 127/196 kB | 115/293 kBProgress (2): 131/196 kB | 115/293 kBProgress (2): 135/196 kB | 115/293 kBProgress (2): 140/196 kB | 115/293 kBProgress (2): 144/196 kB | 115/293 kBProgress (2): 148/196 kB | 115/293 kBProgress (2): 152/196 kB | 115/293 kBProgress (2): 156/196 kB | 115/293 kBProgress (2): 160/196 kB | 115/293 kBProgress (2): 164/196 kB | 115/293 kBProgress (2): 164/196 kB | 119/293 kBProgress (2): 164/196 kB | 123/293 kBProgress (2): 164/196 kB | 127/293 kBProgress (2): 164/196 kB | 131/293 kBProgress (2): 168/196 kB | 131/293 kBProgress (2): 172/196 kB | 131/293 kBProgress (2): 176/196 kB | 131/293 kBProgress (2): 180/196 kB | 131/293 kBProgress (2): 185/196 kB | 131/293 kBProgress (2): 189/196 kB | 131/293 kBProgress (2): 193/196 kB | 131/293 kBProgress (2): 196 kB | 131/293 kB    Progress (2): 196 kB | 135/293 kBProgress (2): 196 kB | 140/293 kBProgress (2): 196 kB | 144/293 kBProgress (2): 196 kB | 148/293 kBProgress (2): 196 kB | 152/293 kBProgress (2): 196 kB | 156/293 kBProgress (2): 196 kB | 160/293 kBProgress (2): 196 kB | 164/293 kBProgress (2): 196 kB | 168/293 kBProgress (2): 196 kB | 172/293 kBProgress (2): 196 kB | 176/293 kBProgress (2): 196 kB | 180/293 kBProgress (2): 196 kB | 185/293 kBProgress (2): 196 kB | 189/293 kBProgress (2): 196 kB | 193/293 kBProgress (2): 196 kB | 197/293 kBProgress (2): 196 kB | 201/293 kBProgress (2): 196 kB | 205/293 kBProgress (2): 196 kB | 209/293 kBProgress (2): 196 kB | 213/293 kBProgress (2): 196 kB | 217/293 kBProgress (2): 196 kB | 221/293 kBProgress (2): 196 kB | 226/293 kBProgress (2): 196 kB | 230/293 kBProgress (2): 196 kB | 234/293 kBProgress (2): 196 kB | 238/293 kBProgress (2): 196 kB | 242/293 kBProgress (2): 196 kB | 246/293 kBProgress (2): 196 kB | 250/293 kBProgress (2): 196 kB | 254/293 kBProgress (2): 196 kB | 258/293 kBProgress (2): 196 kB | 262/293 kB                                 Downloaded from central: https://repo.maven.apache.org/maven2/org/apache/maven/surefire/surefire-api/2.19.1/surefire-api-2.19.1.jar (196 kB at 113 kB/s)
Progress (1): 267/293 kBProgress (1): 271/293 kBProgress (1): 275/293 kBProgress (1): 279/293 kBProgress (1): 283/293 kBProgress (1): 287/293 kBProgress (1): 291/293 kBProgress (1): 293 kB                        Downloaded from central: https://repo.maven.apache.org/maven2/org/apache/maven/surefire/maven-surefire-common/2.19.1/maven-surefire-common-2.19.1.jar (293 kB at 142 kB/s)
[INFO] No tests to run.
Downloading from central: https://repo.maven.apache.org/maven2/org/apache/maven/surefire/surefire-testng/2.19.1/surefire-testng-2.19.1.pom
Progress (1): 2.3 kB                    Downloaded from central: https://repo.maven.apache.org/maven2/org/apache/maven/surefire/surefire-testng/2.19.1/surefire-testng-2.19.1.pom (2.3 kB at 4.0 kB/s)
Downloading from central: https://repo.maven.apache.org/maven2/org/apache/maven/surefire/surefire-providers/2.19.1/surefire-providers-2.19.1.pom
Progress (1): 2.6 kB                    Downloaded from central: https://repo.maven.apache.org/maven2/org/apache/maven/surefire/surefire-providers/2.19.1/surefire-providers-2.19.1.pom (2.6 kB at 4.1 kB/s)
Downloading from central: https://repo.maven.apache.org/maven2/org/apache/maven/surefire/common-java5/2.19.1/common-java5-2.19.1.pom
Progress (1): 2.7 kB                    Downloaded from central: https://repo.maven.apache.org/maven2/org/apache/maven/surefire/common-java5/2.19.1/common-java5-2.19.1.pom (2.7 kB at 4.7 kB/s)
Downloading from central: https://repo.maven.apache.org/maven2/org/apache/maven/surefire/surefire-testng-utils/2.19.1/surefire-testng-utils-2.19.1.pom
Progress (1): 3.1 kB                    Downloaded from central: https://repo.maven.apache.org/maven2/org/apache/maven/surefire/surefire-testng-utils/2.19.1/surefire-testng-utils-2.19.1.pom (3.1 kB at 5.4 kB/s)
Downloading from central: https://repo.maven.apache.org/maven2/org/apache/maven/surefire/surefire-grouper/2.19.1/surefire-grouper-2.19.1.pom
Progress (1): 2.6 kB                    Downloaded from central: https://repo.maven.apache.org/maven2/org/apache/maven/surefire/surefire-grouper/2.19.1/surefire-grouper-2.19.1.pom (2.6 kB at 4.7 kB/s)
Downloading from central: https://repo.maven.apache.org/maven2/org/apache/maven/surefire/common-java5/2.19.1/common-java5-2.19.1.jar
Downloading from central: https://repo.maven.apache.org/maven2/org/apache/maven/surefire/surefire-testng-utils/2.19.1/surefire-testng-utils-2.19.1.jar
Downloading from central: https://repo.maven.apache.org/maven2/org/apache/maven/surefire/surefire-grouper/2.19.1/surefire-grouper-2.19.1.jar
Downloading from central: https://repo.maven.apache.org/maven2/org/apache/maven/surefire/surefire-testng/2.19.1/surefire-testng-2.19.1.jar
Progress (1): 4.1/38 kBProgress (2): 4.1/38 kB | 4.1/44 kBProgress (3): 4.1/38 kB | 4.1/44 kB | 2.7/42 kBProgress (3): 8.2/38 kB | 4.1/44 kB | 2.7/42 kBProgress (3): 8.2/38 kB | 8.2/44 kB | 2.7/42 kBProgress (3): 12/38 kB | 8.2/44 kB | 2.7/42 kB Progress (3): 12/38 kB | 12/44 kB | 2.7/42 kB Progress (3): 16/38 kB | 12/44 kB | 2.7/42 kBProgress (3): 16/38 kB | 16/44 kB | 2.7/42 kBProgress (3): 16/38 kB | 20/44 kB | 2.7/42 kBProgress (3): 16/38 kB | 25/44 kB | 2.7/42 kBProgress (3): 16/38 kB | 29/44 kB | 2.7/42 kBProgress (3): 16/38 kB | 33/44 kB | 2.7/42 kBProgress (4): 16/38 kB | 33/44 kB | 2.7/42 kB | 4.1/27 kBProgress (4): 16/38 kB | 33/44 kB | 2.7/42 kB | 8.2/27 kBProgress (4): 16/38 kB | 33/44 kB | 2.7/42 kB | 12/27 kB Progress (4): 16/38 kB | 33/44 kB | 2.7/42 kB | 16/27 kBProgress (4): 16/38 kB | 33/44 kB | 5.5/42 kB | 16/27 kBProgress (4): 20/38 kB | 33/44 kB | 5.5/42 kB | 16/27 kBProgress (4): 20/38 kB | 37/44 kB | 5.5/42 kB | 16/27 kBProgress (4): 25/38 kB | 37/44 kB | 5.5/42 kB | 16/27 kBProgress (4): 25/38 kB | 41/44 kB | 5.5/42 kB | 16/27 kBProgress (4): 29/38 kB | 41/44 kB | 5.5/42 kB | 16/27 kBProgress (4): 29/38 kB | 44 kB | 5.5/42 kB | 16/27 kB   Progress (4): 33/38 kB | 44 kB | 5.5/42 kB | 16/27 kBProgress (4): 37/38 kB | 44 kB | 5.5/42 kB | 16/27 kBProgress (4): 38 kB | 44 kB | 5.5/42 kB | 16/27 kB   Progress (4): 38 kB | 44 kB | 8.2/42 kB | 16/27 kBProgress (4): 38 kB | 44 kB | 8.2/42 kB | 20/27 kBProgress (4): 38 kB | 44 kB | 11/42 kB | 20/27 kB Progress (4): 38 kB | 44 kB | 11/42 kB | 25/27 kBProgress (4): 38 kB | 44 kB | 11/42 kB | 27 kB   Progress (4): 38 kB | 44 kB | 14/42 kB | 27 kBProgress (4): 38 kB | 44 kB | 16/42 kB | 27 kBProgress (4): 38 kB | 44 kB | 19/42 kB | 27 kBProgress (4): 38 kB | 44 kB | 22/42 kB | 27 kBProgress (4): 38 kB | 44 kB | 25/42 kB | 27 kBProgress (4): 38 kB | 44 kB | 27/42 kB | 27 kBProgress (4): 38 kB | 44 kB | 30/42 kB | 27 kBProgress (4): 38 kB | 44 kB | 33/42 kB | 27 kBProgress (4): 38 kB | 44 kB | 36/42 kB | 27 kBProgress (4): 38 kB | 44 kB | 38/42 kB | 27 kBProgress (4): 38 kB | 44 kB | 41/42 kB | 27 kBProgress (4): 38 kB | 44 kB | 42 kB | 27 kB                                              Downloaded from central: https://repo.maven.apache.org/maven2/org/apache/maven/surefire/surefire-grouper/2.19.1/surefire-grouper-2.19.1.jar (38 kB at 67 kB/s)
Downloaded from central: https://repo.maven.apache.org/maven2/org/apache/maven/surefire/common-java5/2.19.1/common-java5-2.19.1.jar (44 kB at 75 kB/s)
Downloaded from central: https://repo.maven.apache.org/maven2/org/apache/maven/surefire/surefire-testng-utils/2.19.1/surefire-testng-utils-2.19.1.jar (27 kB at 45 kB/s)
Downloaded from central: https://repo.maven.apache.org/maven2/org/apache/maven/surefire/surefire-testng/2.19.1/surefire-testng-2.19.1.jar (42 kB at 52 kB/s)

-------------------------------------------------------
 T E S T S
-------------------------------------------------------
Running TestSuite
Hello Google...
Priority - 1
Priority - 2
Priority - 3
Priority - 4
Tests run: 4, Failures: 4, Errors: 0, Skipped: 0, Time elapsed: 3.641 sec <<< FAILURE! - in TestSuite
openBrowser(seleniumTestNGPriority.Priority_In_testNG)  Time elapsed: 0.518 sec  <<< FAILURE!
java.lang.IllegalStateException: The driver executable does not exist: D:\tools\chromedriver_win32\chromedriver.exe
	at seleniumTestNGPriority.Priority_In_testNG.openBrowser(Priority_In_testNG.java:21)

launchGoogle(seleniumTestNGPriority.Priority_In_testNG)  Time elapsed: 0 sec  <<< FAILURE!
java.lang.NullPointerException
	at seleniumTestNGPriority.Priority_In_testNG.launchGoogle(Priority_In_testNG.java:37)

peformSeachAndClick1stLink(seleniumTestNGPriority.Priority_In_testNG)  Time elapsed: 0.019 sec  <<< FAILURE!
java.lang.NullPointerException
	at seleniumTestNGPriority.Priority_In_testNG.peformSeachAndClick1stLink(Priority_In_testNG.java:45)

FaceBookPageTitleVerification(seleniumTestNGPriority.Priority_In_testNG)  Time elapsed: 0.001 sec  <<< FAILURE!
java.lang.NullPointerException
	at seleniumTestNGPriority.Priority_In_testNG.FaceBookPageTitleVerification(Priority_In_testNG.java:57)


Results :

Failed tests: 
  Priority_In_testNG.FaceBookPageTitleVerification:57 NullPointer
  Priority_In_testNG.launchGoogle:37 NullPointer
  Priority_In_testNG.openBrowser:21 » IllegalState The driver executable does no...
  Priority_In_testNG.peformSeachAndClick1stLink:45 NullPointer

Tests run: 4, Failures: 4, Errors: 0, Skipped: 0

[INFO] ------------------------------------------------------------------------
[INFO] BUILD FAILURE
[INFO] ------------------------------------------------------------------------
[INFO] Total time:  28.231 s
[INFO] Finished at: 2021-09-03T05:03:22-07:00
[INFO] ------------------------------------------------------------------------
[8mha:////4IZGiMxReiVstmBUkd/DN8H0hlw8I+3HnR8c7TF61TKDAAAAYB+LCAAAAAAAAP9b85aBtbiIQSmjNKU4P0+vJLE4u1gvPjexLDVPzxdEuhYV5Rf55Zek1m9pfpLfVWLNxMBQUcQgBdWQnJ9XnJ+TqucMoUEKGSCAEaSwAABqVhoSYAAAAA==[0m[ERROR] Failed to execute goal org.apache.maven.plugins:maven-surefire-plugin:2.19.1:test (default-test) on project seleniumTestNGPriority: There are test failures.
[8mha:////4IZGiMxReiVstmBUkd/DN8H0hlw8I+3HnR8c7TF61TKDAAAAYB+LCAAAAAAAAP9b85aBtbiIQSmjNKU4P0+vJLE4u1gvPjexLDVPzxdEuhYV5Rf55Zek1m9pfpLfVWLNxMBQUcQgBdWQnJ9XnJ+TqucMoUEKGSCAEaSwAABqVhoSYAAAAA==[0m[ERROR] 
[8mha:////4IZGiMxReiVstmBUkd/DN8H0hlw8I+3HnR8c7TF61TKDAAAAYB+LCAAAAAAAAP9b85aBtbiIQSmjNKU4P0+vJLE4u1gvPjexLDVPzxdEuhYV5Rf55Zek1m9pfpLfVWLNxMBQUcQgBdWQnJ9XnJ+TqucMoUEKGSCAEaSwAABqVhoSYAAAAA==[0m[ERROR] Please refer to C:\Windows\System32\config\systemprofile\AppData\Local\Jenkins\.jenkins\workspace\selenium-webdriver\target\surefire-reports for the individual test results.
[8mha:////4IZGiMxReiVstmBUkd/DN8H0hlw8I+3HnR8c7TF61TKDAAAAYB+LCAAAAAAAAP9b85aBtbiIQSmjNKU4P0+vJLE4u1gvPjexLDVPzxdEuhYV5Rf55Zek1m9pfpLfVWLNxMBQUcQgBdWQnJ9XnJ+TqucMoUEKGSCAEaSwAABqVhoSYAAAAA==[0m[ERROR] -> [Help 1]
[8mha:////4IZGiMxReiVstmBUkd/DN8H0hlw8I+3HnR8c7TF61TKDAAAAYB+LCAAAAAAAAP9b85aBtbiIQSmjNKU4P0+vJLE4u1gvPjexLDVPzxdEuhYV5Rf55Zek1m9pfpLfVWLNxMBQUcQgBdWQnJ9XnJ+TqucMoUEKGSCAEaSwAABqVhoSYAAAAA==[0m[ERROR] 
[8mha:////4IZGiMxReiVstmBUkd/DN8H0hlw8I+3HnR8c7TF61TKDAAAAYB+LCAAAAAAAAP9b85aBtbiIQSmjNKU4P0+vJLE4u1gvPjexLDVPzxdEuhYV5Rf55Zek1m9pfpLfVWLNxMBQUcQgBdWQnJ9XnJ+TqucMoUEKGSCAEaSwAABqVhoSYAAAAA==[0m[ERROR] To see the full stack trace of the errors, re-run Maven with the -e switch.
[8mha:////4IZGiMxReiVstmBUkd/DN8H0hlw8I+3HnR8c7TF61TKDAAAAYB+LCAAAAAAAAP9b85aBtbiIQSmjNKU4P0+vJLE4u1gvPjexLDVPzxdEuhYV5Rf55Zek1m9pfpLfVWLNxMBQUcQgBdWQnJ9XnJ+TqucMoUEKGSCAEaSwAABqVhoSYAAAAA==[0m[ERROR] Re-run Maven using the -X switch to enable full debug logging.
[8mha:////4IZGiMxReiVstmBUkd/DN8H0hlw8I+3HnR8c7TF61TKDAAAAYB+LCAAAAAAAAP9b85aBtbiIQSmjNKU4P0+vJLE4u1gvPjexLDVPzxdEuhYV5Rf55Zek1m9pfpLfVWLNxMBQUcQgBdWQnJ9XnJ+TqucMoUEKGSCAEaSwAABqVhoSYAAAAA==[0m[ERROR] 
[8mha:////4IZGiMxReiVstmBUkd/DN8H0hlw8I+3HnR8c7TF61TKDAAAAYB+LCAAAAAAAAP9b85aBtbiIQSmjNKU4P0+vJLE4u1gvPjexLDVPzxdEuhYV5Rf55Zek1m9pfpLfVWLNxMBQUcQgBdWQnJ9XnJ+TqucMoUEKGSCAEaSwAABqVhoSYAAAAA==[0m[ERROR] For more information about the errors and possible solutions, please read the following articles:
[8mha:////4IZGiMxReiVstmBUkd/DN8H0hlw8I+3HnR8c7TF61TKDAAAAYB+LCAAAAAAAAP9b85aBtbiIQSmjNKU4P0+vJLE4u1gvPjexLDVPzxdEuhYV5Rf55Zek1m9pfpLfVWLNxMBQUcQgBdWQnJ9XnJ+TqucMoUEKGSCAEaSwAABqVhoSYAAAAA==[0m[ERROR] [Help 1] http://cwiki.apache.org/confluence/display/MAVEN/MojoFailureException
Build step 'Invoke top-level Maven targets' marked build as failure
Recording test results
[Checks API] No suitable checks publisher found.
TestNG Reports Processing: START
Looking for TestNG results report in workspace using pattern: **/testng-results.xml
Saving reports...
Processing '/var/lib/jenkins/jobs/selenium-webdriver/builds/1/testng/testng-results.xml'
100.000000% of tests failed, which exceeded threshold of 0%. Marking build as UNSTABLE
TestNG Reports Processing: FINISH
[Checks API] No suitable checks publisher found.
Finished: FAILURE
